<!DOCTYPE settings SYSTEM "../settings.dtd">

<!-- A conf to use to tune a new A/C -->

<settings>
  <dl_settings>

    <dl_settings NAME="control">
      <dl_settings NAME="attitude">
        <dl_setting MAX="15000" MIN="0" STEP="250" VAR="h_ctl_roll_attitude_gain" shortname="roll_pgain" param="H_CTL_ROLL_ATTITUDE_GAIN" module="stabilization/stabilization_attitude"/>
        <dl_setting MAX="15000" MIN="0" STEP="250" VAR="h_ctl_roll_rate_gain" shortname="roll_dgain" param="H_CTL_ROLL_RATE_GAIN" module="stabilization/stabilization_attitude"/>
        <dl_setting MAX="5000" MIN="0" STEP="10" VAR="h_ctl_roll_igain" shortname="roll_igain" param="H_CTL_ROLL_IGAIN" handler="SetRollIGain" module="stabilization/stabilization_adaptive"/>
        <dl_setting MAX="25000" MIN="0" STEP="250" VAR="h_ctl_pitch_pgain" shortname="pitch_pgain" param="H_CTL_PITCH_PGAIN" module="stabilization/stabilization_attitude"/>
        <dl_setting MAX="50000" MIN="0" STEP="250" VAR="h_ctl_pitch_dgain" shortname="pitch_dgain" param="H_CTL_PITCH_DGAIN" module="stabilization/stabilization_attitude"/>
        <dl_setting MAX="5000" MIN="0" STEP="10" VAR="h_ctl_pitch_igain" shortname="pitch_igain" param="H_CTL_PITCH_IGAIN" handler="SetPitchIGain" module="stabilization/stabilization_adaptive"/>
        <dl_setting MAX=".3" MIN="0." STEP="0.001" VAR="h_ctl_pitch_of_roll" shortname="pitch_of_roll" param="H_CTL_PITCH_OF_ROLL" module="stabilization/stabilization_attitude"/>
        <dl_setting MAX="5000" MIN="0" STEP="100" VAR="h_ctl_aileron_of_throttle" shortname="aileron_of_throttle" module="stabilization/stabilization_adaptive"/>

        <dl_setting MAX="60" MIN="0" STEP="1." VAR="h_ctl_roll_max_setpoint" shortname="max_roll" param="H_CTL_ROLL_MAX_SETPOINT" unit="rad" alt_unit="deg"/>
        <dl_setting MAX="1" MIN="0" STEP="1" var="use_airspeed_ratio" values="FALSE|TRUE"/>
      </dl_settings>

      <dl_settings NAME="feedforward">
        <dl_setting MAX="5000" MIN="0" STEP="10" VAR="h_ctl_roll_Kffa" shortname="roll_Kffa" param="H_CTL_ROLL_KFFA"/>
        <dl_setting MAX="5000" MIN="0" STEP="10" VAR="h_ctl_roll_Kffd" shortname="roll_Kffd" param="H_CTL_ROLL_KFFD"/>
        <dl_setting MAX="5000" MIN="0" STEP="10" VAR="h_ctl_pitch_Kffa" shortname="pitch_Kffa" param="H_CTL_PITCH_KFFA"/>
        <dl_setting MAX="5000" MIN="0" STEP="10" VAR="h_ctl_pitch_Kffd" shortname="pitch_Kffd" param="H_CTL_PITCH_KFFD"/>
      </dl_settings>
    </dl_settings>
  </dl_settings>
</settings>
