<!DOCTYPE settings SYSTEM "../settings.dtd">
<settings>
  <dl_settings>
    <dl_settings NAME="indi">
      <dl_setting var="indi.reference_acceleration.err_p" min="0" step="1" max="500" module="stabilization/stabilization_attitude_quat_indi" shortname="kp_p"/>
      <dl_setting var="indi.reference_acceleration.rate_p" min="0" step="0.1" max="100" module="stabilization/stabilization_attitude_quat_indi" shortname="kd_p"/>
      <dl_setting var="indi.g1.p" min="0" step="1" max="500" module="stabilization/stabilization_attitude_quat_indi" shortname="ctl_eff_p"/>
      <dl_setting var="indi.reference_acceleration.err_q" min="0" step="1" max="500" module="stabilization/stabilization_attitude_quat_indi" shortname="kp_q"/>
      <dl_setting var="indi.reference_acceleration.rate_q" min="0" step="0.1" max="100" module="stabilization/stabilization_attitude_quat_indi" shortname="kd_q"/>
      <dl_setting var="indi.g1.q" min="0" step="1" max="500" module="stabilization/stabilization_attitude_quat_indi" shortname="ctl_eff_q"/>
      <dl_setting var="indi.reference_acceleration.err_r" min="0" step="1" max="500" module="stabilization/stabilization_attitude_quat_indi" shortname="kp_r"/>
      <dl_setting var="indi.reference_acceleration.rate_r" min="0" step="0.1" max="100" module="stabilization/stabilization_attitude_quat_indi" shortname="kd_r"/>
      <dl_setting var="indi.g1.r" min="0" step="1" max="500" module="stabilization/stabilization_attitude_quat_indi" shortname="ctl_eff_r"/>
      <dl_setting var="indi.adaptive" min="0" step="1" max="1" module="stabilization/stabilization_attitude_quat_indi" shortname="adaptive" values="FALSE|TRUE" param="ADAPTIVE_INDI"/>
<!--       <dl_setting var="indi.lambda_inv" min="1" step="1000" max="1000000000" module="stabilization/stabilization_attitude_quat_indi" shortname="lambda_inv"/> -->
    </dl_settings>
  </dl_settings>
</settings>
